{
  "name": "tilt",
  "duration": 1.5,
  "fade_in": 0.2,
  "fade_out": 0.3,
  "curves": [
    {
      "target": { "kind": "parameter", "id": "AngleZ" },
      "segments": [
        { "type": "start", "p": { "t": 0.0, "v": 0.0 } },
        { "type": "bezier", "c1": { "t": 0.2, "v": 0.0 }, "c2": { "t": 0.3, "v": 25.0 }, "to": { "t": 0.5, "v": 25.0 } },
        { "type": "linear", "to": { "t": 1.0, "v": 25.0 } },
        { "type": "bezier", "c1": { "t": 1.2, "v": 25.0 }, "c2": { "t": 1.3, "v": 0.0 }, "to": { "t": 1.5, "v": 0.0 } }
      ]
    },
    {
      "target": { "kind": "parameter", "id": "EyeBallX" },
      "segments": [
        { "type": "start", "p": { "t": 0.0, "v": 0.0 } },
        { "type": "linear", "to": { "t": 0.4, "v": 0.5 } },
        { "type": "linear", "to": { "t": 1.1, "v": 0.5 } },
        { "type": "linear", "to": { "t": 1.5, "v": 0.0 } }
      ]
    }
  ],
  "events": []
}
