{
  "name": "nod",
  "duration": 1.2,
  "fade_in": 0.2,
  "fade_out": 0.3,
  "curves": [
    {
      "target": { "kind": "parameter", "id": "AngleY" },
      "segments": [
        { "type": "start", "p": { "t": 0.0, "v": 0.0 } },
        { "type": "linear", "to": { "t": 0.3, "v": -25.0 } },
        { "type": "linear", "to": { "t": 0.6, "v": 5.0 } },
        { "type": "linear", "to": { "t": 0.9, "v": -20.0 } },
        { "type": "linear", "to": { "t": 1.2, "v": 0.0 } }
      ]
    }
  ],
  "events": [{ "t": 1.2, "value": "nod-end" }]
}
